{"$id":"urn:randle:r5:future_manifest_fixture","$schema":"https://json-schema.org/draft/2020-12/schema","additionalProperties":false,"properties":{"accepted_specification_identity":{"const":"be59cd97e8a0333298a44af889a35762458b6b336b254f892e39bcbf23c7d76e"},"authorization_state":{"const":"WITHHELD"},"complete_path_set_identity":{"const":"7777777777777777777777777777777777777777777777777777777777777777"},"fixture_only":{"const":true},"immutable_content_address":{"const":"sha256:2222222222222222222222222222222222222222222222222222222222222222"},"interface_version":{"const":"RANDLE-R5-FUTURE-PACKAGE-1"},"package_author_identity":{"const":"future-package-author-fixture"},"package_identity":{"const":"1111111111111111111111111111111111111111111111111111111111111111"},"parent":{"const":"4444444444444444444444444444444444444444"},"prohibited_production_actions":{"items":false,"maxItems":4,"minItems":4,"prefixItems":[{"const":"CAPTURE"},{"const":"DEPLOY"},{"const":"RESTART"},{"const":"TRADE"}],"type":"array"},"schema_version":{"const":"7.0.0-DRAFT"},"script_identity":{"const":"5555555555555555555555555555555555555555555555555555555555555555"},"support_module_identities":{"items":false,"maxItems":1,"minItems":1,"prefixItems":[{"const":"6666666666666666666666666666666666666666666666666666666666666666"}],"type":"array"},"tree":{"const":"3333333333333333333333333333333333333333"}},"required":["schema_version","package_identity","package_author_identity","immutable_content_address","tree","parent","script_identity","support_module_identities","complete_path_set_identity","accepted_specification_identity","interface_version","prohibited_production_actions","authorization_state","fixture_only"],"type":"object"}
