{"accepted_specification_identity":"be59cd97e8a0333298a44af889a35762458b6b336b254f892e39bcbf23c7d76e","authorization_state":"WITHHELD","complete_path_set_identity":"7777777777777777777777777777777777777777777777777777777777777777","fixture_only":true,"immutable_content_address":"sha256:2222222222222222222222222222222222222222222222222222222222222222","interface_version":"RANDLE-R5-FUTURE-PACKAGE-1","package_author_identity":"future-package-author-fixture","package_identity":"1111111111111111111111111111111111111111111111111111111111111111","parent":"4444444444444444444444444444444444444444","prohibited_production_actions":["CAPTURE","DEPLOY","RESTART","TRADE"],"schema_version":"7.0.0-DRAFT","script_identity":"5555555555555555555555555555555555555555555555555555555555555555","support_module_identities":["6666666666666666666666666666666666666666666666666666666666666666"],"tree":"3333333333333333333333333333333333333333"}
